{
  "schema": "cross_ref_dss_to_states_draft_v2",
  "disclaimer": "B-Track parallel-corpus draft only; not A-Track SSOT; trading engine must not load this path by default. Source standard (proxies, not autographs): bulk apocrypha in-repo uses Sefaria-tagged JSONL (`data/logos/manuscripts/apocrypha_std.jsonl`, per-row `source`). Excerpt MDs may cite R.H. Charles, Charlesworth, Wikisource, or similar. DSS `satellite_ref` lines are thematic alignment notes and do not assert Oxford/DJD diplomatic text unless that edition is explicitly named there. Acquisition of closed-licence critical editions (e.g. DJD) is out of scope for this draft.",
  "generated_at_utc": "2026-03-30T22:00:00+00:00",
  "constitution_ref": "docs/final/CONSTITUTION_INFERENCE_IMPLEMENTATION_FACTS.md §4.5",
  "canonical_join_ssot": "docs/final/artifacts/LOGOS_STATE_MAPPING_V1.json",
  "canonical_join_note": "canonical_ref = verse_id for the same state_id as state_candidate_id (cosine assignment snapshot); not independent thematic exegesis.",
  "entries": [
    {
      "entry_id": "ENTRY_01",
      "canonical_ref": "Lev.21.4",
      "satellite_ref": "1QM 1:1-7 (War Scroll, Col.1)",
      "source_id": "1QM 1:1-7 (War Scroll, Col.1)",
      "corpus_type": "dss",
      "link_type": "thematic",
      "confidence": null,
      "artifact_path": null,
      "state_candidate_id": 1,
      "rationale": "B-Track DSS: 빛의 아들들 vs 벨리알·키팀·언약 위반자의 개전 서사. A-Track 비유 후보(가설): 극단적 방향성·돌파 국면 — dual_regime·리스크 캡과 무관."
    },
    {
      "entry_id": "ENTRY_02",
      "canonical_ref": "Ezra.2.49",
      "satellite_ref": "1Enoch 10:4-6 (Charles / Wikisource ch.10)",
      "source_id": "1Enoch 10:4-6 (Charles / Wikisource ch.10)",
      "corpus_type": "apocrypha",
      "link_type": "thematic",
      "confidence": null,
      "artifact_path": null,
      "state_candidate_id": 15,
      "rationale": "B-Track Apocrypha: 아자젤 결박·어둠·대심판의 불. A-Track 비유 후보(가설): 청산·극단 공포(Capitulation) — State 16 후보와 인접 축으로 별도 행 구분 가능."
    },
    {
      "entry_id": "ENTRY_03",
      "canonical_ref": "1Chr.3.7",
      "satellite_ref": "1Enoch 10:7 (Charles / Wikisource ch.10)",
      "source_id": "1Enoch 10:7 (Charles / Wikisource ch.10)",
      "corpus_type": "apocrypha",
      "link_type": "thematic",
      "confidence": null,
      "artifact_path": null,
      "state_candidate_id": 2,
      "rationale": "B-Track Apocrypha: 타락한 땅의 치유 선포·멸망 방지. A-Track 비유 후보(가설): 심판 국면 이후 질서·반등 서사(V·전환) — 확정 신호 아님."
    },
    {
      "entry_id": "ENTRY_04",
      "canonical_ref": "1Chr.8.31",
      "satellite_ref": "Jubilees 6:29-38 + 364-day notes (btrack_apocrypha_jubilees_ch6_excerpt_charles.md; btrack_apocrypha_jubilees_calendar_364.md)",
      "source_id": "Jubilees 6:29-38 + 364-day notes (btrack_apocrypha_jubilees_ch6_excerpt_charles.md; btrack_apocrypha_jubilees_calendar_364.md)",
      "corpus_type": "pseudepigrapha",
      "link_type": "temporal",
      "confidence": null,
      "artifact_path": null,
      "state_candidate_id": 8,
      "rationale": "B-Track Apocrypha: 364일·분기·음력과의 긴장, 정해진 절기 질서. A-Track 비유 후보(가설): 하드코딩된 반감기·주기 신뢰·저변동 인내 — 횡보·매집 담론과 병치 가능."
    },
    {
      "entry_id": "ENTRY_05",
      "canonical_ref": "Ps.27.10",
      "satellite_ref": "1QS IX 10-11 (Community Rule; Eng. citation in btrack_dss_1QS_sectarian_context.md)",
      "source_id": "1QS IX 10-11 (Community Rule; Eng. citation in btrack_dss_1QS_sectarian_context.md)",
      "corpus_type": "dss",
      "link_type": "thematic",
      "confidence": null,
      "artifact_path": null,
      "state_candidate_id": 3,
      "rationale": "B-Track DSS: 예언자와 아론·이스라엘의 기름부음 받은 자에 대한 기대. A-Track 비유 후보(가설): 규율·언약 공동체·장기 신념 — HODL 담론은 비유일 뿐 자동 트리거 금지."
    },
    {
      "entry_id": "ENTRY_06",
      "canonical_ref": "Exod.20.15",
      "satellite_ref": "1QpHab (1Q15) | loc=col.VII, line=1-17 (Qumran-Digital transcription table) | refs=St.Mark's I (ASOR 1950), DSS Study Edition (Brill), Qumran-Digital 1QpHab transcription (2024-04-29) | status=partial_anchor_verified (column+line-range)",
      "source_id": "1QpHab (1Q15) | loc=col.VII, line=1-17 (Qumran-Digital transcription table) | refs=St.Mark's I (ASOR 1950), DSS Study Edition (Brill), Qumran-Digital 1QpHab transcription (2024-04-29) | status=partial_anchor_verified (column+line-range)",
      "corpus_type": "dss",
      "link_type": "thematic",
      "confidence": null,
      "artifact_path": null,
      "state_candidate_id": 4,
      "rationale": "B-Track DSS: 하바국 해석(페셔)의 ‘위기를 성경으로 재독’ 레이어. A-Track 비유 후보(가설): 규범·도덕 프레임(칠선 언약 맥락)과 시장 서사 병치 — geometry/trigger 아님; Fact-Lock 벤치만."
    },
    {
      "entry_id": "ENTRY_07",
      "canonical_ref": "Ezra.2.45",
      "satellite_ref": "11QT (11Q19) | loc=cols.XLVI-XLVII, line=TBD (public line-level transcription unavailable in consulted open sources) | refs=Yadin 1977-1983 (11Q19 primary); DJD XXIII (11Q20-31, Temple b/c comparanda) | status=partial_anchor_verified (column-range)",
      "source_id": "11QT (11Q19) | loc=cols.XLVI-XLVII, line=TBD (public line-level transcription unavailable in consulted open sources) | refs=Yadin 1977-1983 (11Q19 primary); DJD XXIII (11Q20-31, Temple b/c comparanda) | status=partial_anchor_verified (column-range)",
      "corpus_type": "dss",
      "link_type": "temporal",
      "confidence": null,
      "artifact_path": null,
      "state_candidate_id": 5,
      "rationale": "B-Track DSS: 성전·절기 일정 규범 텍스트. A-Track 대비: Ezra 명단 행은 ‘복귀 코호트’ 스냅샷 — 달력 DSS와 주제만 병치(벤치); 인과·트리거 금지.",
      "note": "Bench policy: temporal(성전/절기) 후보. 승격 조건=11Q19 cols.XLVI-XLVII의 공개 line 전사 확보 + Ezra.2.45와의 병치 규칙 유지. 반증 훅=절기 규범을 복귀 명단의 직접 인과로 해석하는 경우. Local evidence (2026-03-30): consulted open sources에서 column 표기(XLVI-XLVII)는 확인되나 line-level 전사는 확인되지 않아 line anchor는 TBD 유지."
    },
    {
      "entry_id": "ENTRY_08",
      "canonical_ref": "Neh.7.56",
      "satellite_ref": "4Q319 (4QOtot) | loc=fragment/sigla=4QOtot, plate=Pls X-XIII, line=TBD (public line transcription unavailable in consulted open sources) | refs=DJD XXI (Talmon et al. 2001), IAA 4Q319 archive page | status=partial_anchor_verified (sigla+plates)",
      "source_id": "4Q319 (4QOtot) | loc=fragment/sigla=4QOtot, plate=Pls X-XIII, line=TBD (public line transcription unavailable in consulted open sources) | refs=DJD XXI (Talmon et al. 2001), IAA 4Q319 archive page | status=partial_anchor_verified (sigla+plates)",
      "corpus_type": "dss",
      "link_type": "temporal",
      "confidence": null,
      "artifact_path": null,
      "state_candidate_id": 6,
      "rationale": "B-Track DSS: 제사장 주기·신호 표류. A-Track 대비: Nehemiah 복귀자 명단 행 — 인구/재건 흐름과 ‘주기 신호’ 담론만 병치(벤치).",
      "note": "Bench policy: temporal(주기/신호) 후보. 승격 조건=4Q319 fragment별 line anchor 확보 + Neh.7.56 명단형 메타와의 병치 규칙 유지. 반증 훅=달력 표식을 직접 인과 트리거로 오독하는 경우. Local evidence (2026-03-30): DJD XXI에서 4QOtot의 plate 범위(Pls X-XIII) 확인, IAA 공개 아카이브 페이지에서는 line 전사가 제공되지 않아 line anchor는 TBD 유지."
    },
    {
      "entry_id": "ENTRY_09",
      "canonical_ref": "Ps.36.1",
      "satellite_ref": "4Q169 (4QpNah) | loc=frags 3-4, col.ii, line=1-12 | refs=DJD V (Allegro 1968), DSS Study Edition (Brill), Qumran-Digital 4Q169 transcription (2025-03-11) | status=partial_anchor_verified (frag+col+line-range)",
      "source_id": "4Q169 (4QpNah) | loc=frags 3-4, col.ii, line=1-12 | refs=DJD V (Allegro 1968), DSS Study Edition (Brill), Qumran-Digital 4Q169 transcription (2025-03-11) | status=partial_anchor_verified (frag+col+line-range)",
      "corpus_type": "dss",
      "link_type": "thematic",
      "confidence": null,
      "artifact_path": null,
      "state_candidate_id": 7,
      "rationale": "B-Track DSS: 나훔 페셔의 악행 귀속·심판 화법. A-Track 대비: 시36 ‘악인의 죄’ 서사와 주제 병치 — 수치/심리 트리거 아님.",
      "note": "Bench policy: thematic(심판/악행 귀속) 후보. 승격 조건=DJD 표기 기준 line crosswalk의 직접 대조 완료. 반증 훅=페셔 정치-역사 문맥을 시편 심리 문맥과 직접 동일시하는 경우. Local evidence (2026-03-30): Qumran-Digital 4Q169 전사에서 frgs 3-4 col.ii line 1-12 연속 구간 확인."
    },
    {
      "entry_id": "ENTRY_10",
      "canonical_ref": "Josh.15.22",
      "satellite_ref": "CD-A I-II (+4Q266-273) | loc=4QDamascus Document witnesses -> DJD XVIII plates I–XLII; 4Q267 frg.2 line 4 attests boundary-language (מסיגי גבול), but direct CD-A I-II line crosswalk remains TBD | refs=Charlesworth PTSDSSP 1995, DJD XVIII (Baumgarten 1996), Qumran-Digital 4Q267 transcription (2023-10-25) | status=partial_anchor_verified (plates+line)",
      "source_id": "CD-A I-II (+4Q266-273) | loc=4QDamascus Document witnesses -> DJD XVIII plates I–XLII; 4Q267 frg.2 line 4 attests boundary-language (מסיגי גבול), but direct CD-A I-II line crosswalk remains TBD | refs=Charlesworth PTSDSSP 1995, DJD XVIII (Baumgarten 1996), Qumran-Digital 4Q267 transcription (2023-10-25) | status=partial_anchor_verified (plates+line)",
      "corpus_type": "dss",
      "link_type": "thematic",
      "confidence": null,
      "artifact_path": null,
      "state_candidate_id": 9,
      "rationale": "B-Track DSS: 공동체의 언약·지경 담론. A-Track 대비: 여호수아 지파 경계 점과 ‘땅·경계’ 메타만 병치 — 지리≠가격.",
      "note": "Bench policy: thematic(경계/지경) 후보. 승격 조건=CD-A I-II와 4Q266-273의 직접 line crosswalk 확보. 반증 훅=경계 어휘가 일반 도덕 문맥으로만 남아 Josh.15.22 지경 메타와 구조 정합이 약해지는 경우. Local evidence (2026-03-30): Qumran-Digital 4Q267 frg.2 line 4에서 'מסיגי גבול' 확인되어 line evidence는 partial 반영, CD-A I-II 직결 line은 미확정."
    },
    {
      "entry_id": "ENTRY_11",
      "canonical_ref": "1Chr.14.6",
      "satellite_ref": "1QM.1.1",
      "source_id": "1QM.1.1",
      "corpus_type": "dss",
      "link_type": "analogy_bench",
      "confidence": 0.82,
      "artifact_path": "docs/final/btrack_phase3_cross_ref_snapshot.md",
      "state_candidate_id": 13,
      "rationale": "[HYPO] 금화교역(金火交易) 상전이 벤치: 1Chr.14.6의 '상태'를 에스겔 1:4의 불꽃 환상 및 1QM의 에너지 충돌 서사와 구조적으로 연결. 학계의 비평을 넘어선 '상태 함수' 대칭성 실험용.",